{
  "$schema": "/schemas/data_schema.json",
  "version": 1,
  "metadata": [
    {
      "id": "match_number",
      "display_name": "Match Number",
      "type": "integer"
    },
    {
      "id": "event_key",
      "display_name": "Event Key",
      "type": "string"
    },
    {
      "id": "is_red_alliance",
      "display_name": "Red Alliance",
      "type": "boolean"
    },
    {
      "id": "human_net_scored",
      "display_name": "Human Scored",
      "type": "integer"
    },
    {
      "id": "human_net_missed",
      "display_name": "Human Missed",
      "type": "integer"
    },
    {
      "id": "team_strategy",
      "display_name": "Team Strategy",
      "type": "array",
      "items": "integer"
    },
    {
      "id": "driving_skill",
      "display_name": "Driving Skill",
      "type": "array",
      "items": "integer"
    },
    {
      "id": "mechanical_soundness",
      "display_name": "Mechanical Soundness",
      "type": "array",
      "items": "integer"
    }
  ],
  "auto": [
  ],
  "tele": [
  ],
  "endgame": [
  ]
}